{
  "version": 1,
  "generatedAt": "2026-07-20T22:00:00-04:00",
  "source": "mock",
  "privacy": {
    "promptContentIncluded": false,
    "sourceContentIncluded": false,
    "notes": "Default bridge snapshots are status-only. Prompt and source content stay out unless the user explicitly opts in."
  },
  "tasks": [
    {
      "id": "task-cockpit-ui",
      "title": "Build Codex cockpit",
      "repoPath": "~/Projects/codecks",
      "branch": "codex/all-waves-trackpad-hid",
      "state": "Running",
      "elapsedLabel": "18m",
      "updatedLabel": "now",
      "needsAttention": false,
      "hasUnread": false,
      "effortMode": "Deep",
      "safeSummary": "Mock dashboard, fancy buttons, and themes are being wired first."
    },
    {
      "id": "task-appfunctions",
      "title": "Park AppFunctions",
      "repoPath": "~/Projects/codecks/android",
      "branch": "main",
      "state": "Blocked",
      "elapsedLabel": "parked",
      "updatedLabel": "today",
      "needsAttention": true,
      "hasUnread": false,
      "effortMode": "Unknown",
      "safeSummary": "Integration is preserved but paused until official dependency coordinates are confirmed."
    }
  ]
}

